{
  "schemaVersion": 1,
  "name": "explain-it",
  "displayName": "Explain it",
  "description": "Paste a URL or add a source, get a fast structured explanation. Use 'Set alarm' to schedule daily briefings.",
  "version": "1.0.0",
  "entry": {
    "module": "./index.mjs",
    "export": "handleApi"
  },
  "api": {
    "method": "POST",
    "pathSuffix": "explain-it"
  },
  "capabilities": {
    "required": ["inference"]
  },
  "routes": {
    "dashboardIssueId": 516,
    "slug": "Explain_it"
  },
  "kernel": {
    "authExempt": true
  }
}
