{
  "schemaVersion": 1,
  "name": "inbox",
  "displayName": "Inbox",
  "description": "MeiMei's email inbox — receive, review, and act on messages like a real assistant.",
  "version": "1.0.0",
  "entry": { "module": "./index.mjs", "export": "handleApi" },
  "api": { "method": "POST", "pathSuffix": "inbox" },
  "capabilities": { "required": ["monitor.read"] },
  "routes": { "dashboardIssueId": 563, "slug": "Inbox" },
  "kernel": { "authExempt": true }
}
