{
  "schemaVersion": 1,
  "name": "checklist",
  "displayName": "Checklist",
  "description": "MeiMei Checklist — default Node engine (local SQLite + Ollama); optional python engine for checklist-repo HTTP worker. Bridge for deployed Next.js + Neon.",
  "version": "1.0.0",
  "entry": { "module": "./index.mjs", "export": "handleApi" },
  "api": { "method": "POST", "pathSuffix": "checklist" },
  "capabilities": { "required": ["jobs.enqueue"] },
  "routes": { "dashboardIssueId": 727, "slug": "Checklist" },
  "kernel": { "authExempt": true }
}
