{
  "schemaVersion": 1,
  "name": "supabase-connector",
  "displayName": "Supabase connector",
  "description": "PostgREST health and previews; powers Lead Enrichment source supabase for durable lead rows (mvp-factory-control#631).",
  "version": "1.0.0",
  "entry": { "module": "./index.mjs", "export": "handleApi" },
  "api": { "method": "POST", "pathSuffix": "supabase-connector" },
  "capabilities": { "required": ["env.read"] },
  "routes": { "dashboardIssueId": 631, "slug": "Supabase_connector" },
  "kernel": { "authExempt": true }
}
