{
  "schemaVersion": 1,
  "name": "daily-briefing",
  "displayName": "Daily Briefing",
  "description": "AI-powered daily business briefing",
  "version": "1.0.0",
  "entry": { "module": "./index.mjs", "export": "handleApi" },
  "api": {
    "method": "POST",
    "pathSuffix": "daily-briefing",
    "subroutes": [{ "pathSuffix": "daily-briefing/open", "export": "handleOpenPost" }]
  },
  "capabilities": { "required": ["inference"] },
  "kernel": { "authExempt": true }
}
