{
  "schemaVersion": 1,
  "name": "lead-enrichment",
  "displayName": "Lead Enrichment",
  "description": "Enrich contacts and companies with structured sales data for personalized outreach campaigns.",
  "version": "1.0.0",
  "entry": { "module": "./index.mjs", "export": "handleApi" },
  "api": { "method": "POST", "pathSuffix": "lead-enrichment" },
  "capabilities": { "required": ["inference"] },
  "routes": { "dashboardIssueId": 649, "slug": "Lead_enrichment" },
  "kernel": { "authExempt": true }
}
