{
  "schemaVersion": 1,
  "name": "what-next",
  "displayName": "What next?",
  "description": "Your daily guide — get prioritized recommendations based on your sources and AI analysis.",
  "version": "1.0.0",
  "entry": { "module": "./index.mjs", "export": "handleApi" },
  "api": { "method": "POST", "pathSuffix": "what-next" },
  "capabilities": { "required": ["inference"] },
  "routes": { "dashboardIssueId": 724, "slug": "What_next" },
  "kernel": { "authExempt": true }
}
