{
  "schemaVersion": 1,
  "name": "memory",
  "displayName": "Memory",
  "description": "Business Brain — MeiMei's identity, mission, values, and operating principles as a durable context layer.",
  "version": "1.0.0",
  "entry": { "module": "./index.mjs", "export": "handleApi" },
  "api": { "method": "POST", "pathSuffix": "memory" },
  "capabilities": { "required": ["inference"] },
  "routes": { "dashboardIssueId": 601, "slug": "Memory" },
  "kernel": { "authExempt": true }
}
