{
  "schemaVersion": 1,
  "name": "mission-control",
  "displayName": "Mission Control",
  "description": "Live board of MeiMei activity and state — agent status, runs, failures, and action traces.",
  "version": "1.0.0",
  "entry": { "module": "./index.mjs", "export": "handleApi" },
  "api": { "method": "POST", "pathSuffix": "mission-control" },
  "capabilities": { "required": ["monitor.read"] },
  "routes": { "dashboardIssueId": 635, "slug": "Mission_control" },
  "kernel": { "authExempt": true }
}
