{
  "schemaVersion": 1,
  "name": "lead-outreach",
  "displayName": "Lead outreach",
  "description": "Hyper-personalized cold email campaigns — build sequences and messaging from enriched leads.",
  "version": "1.0.0",
  "entry": { "module": "./index.mjs", "export": "handleApi" },
  "api": { "method": "POST", "pathSuffix": "lead-outreach" },
  "capabilities": { "required": ["inference"] },
  "routes": { "dashboardIssueId": 653, "slug": "Lead_outreach" },
  "kernel": { "authExempt": true }
}
